{
  "project_name": "notes-service",
  "phase": "EXECUTE",
  "active_wave": 2,
  "module_id": "M-002",
  "status": "DONE",
  "summary": "Implemented database setup, SQLAlchemy note model, and CRUD repository functions.",
  "files_touched": [
    "/src/notes_service/db.py",
    "/src/notes_service/models.py",
    "/src/notes_service/repository.py"
  ],
  "resume_anchor": {
    "strategy": "file_boundary",
    "file_path": "/src/notes_service/repository.py",
    "anchor_kind": "file",
    "anchor_value": "complete_file",
    "content_sha256": "4f6c4c6c90d5e7f1d5f5f43bf2a1b97d5d9ca5d4e1b7a6f0aa2f5b2f4d5e0b71",
    "notes": "All persistence files are complete. The next safe step is route integration in M-004 after M-003 joins."
  },
  "verification": {
    "planned": [
      "Repository CRUD tests",
      "python -m py_compile src/notes_service/repository.py"
    ],
    "completed": [
      "python -m py_compile src/notes_service/repository.py"
    ],
    "pending": [
      "Repository CRUD tests"
    ]
  },
  "blockers": [],
  "next_actions": [
    "Join with M-003 outputs.",
    "Start M-004 route integration against frozen repository and auth contracts."
  ]
}
